{
  "$schema": "schemas/cross-ai-takeover.schema.json",
  "schema_version": "1.0.0",
  "id": "acceptance.cross-ai-takeover",
  "purpose": "Prove that a clean checkout can be discovered and exercised without chat memory or vendor-specific hidden context.",
  "entrypoints": [
    {"platform": "vendor-neutral", "path": "AI-BOOTSTRAP.md", "authority": "primary"},
    {"platform": "codex", "path": "AGENTS.md", "authority": "thin-adapter"},
    {"platform": "claude", "path": "CLAUDE.md", "authority": "thin-adapter"},
    {"platform": "kimi", "path": "AI-BOOTSTRAP.md", "authority": "primary"},
    {"platform": "generic-ai", "path": "AI-BOOTSTRAP.md", "authority": "primary"}
  ],
  "required_documents": [
    "docs/01-principles/project-constitution.md",
    "docs/02-architecture/reference-architecture.md",
    "docs/03-security/threat-model.md",
    "docs/08-factory/instance-lifecycle.md",
    "docs/11-lifecycle/installation-upgrade-and-adoption.md",
    "docs/13-team-creator/blueprint-compiler-and-reference-runtime.md",
    "docs/15-upstream-independent/README.md",
    "docs/15-upstream-independent/core-contracts-and-migration.md",
    "docs/15-upstream-independent/adapter-port-sdk.md",
    "docs/15-upstream-independent/native-controller-and-conformance.md",
    "docs/17-guided-adoption/README.md",
    "docs/17-guided-adoption/conversation-protocol.md",
    "docs/17-guided-adoption/plan-contract.md",
    "docs/adr/ADR-0009-vendor-neutral-core-and-replaceable-ports.md",
    "docs/adr/ADR-0010-scenario-first-guided-adoption.md",
    "AI-START.md"
  ],
  "context_roles": [
    "public-intake",
    "triage",
    "product",
    "builder",
    "reviewer",
    "qa",
    "release",
    "operations"
  ],
  "automated_assertions": [
    "repository.valid",
    "entrypoints.route-to-primary",
    "role-contexts.hash-bound",
    "instance.generated-and-diagnosed",
    "target-repository.unchanged",
    "guided-adoption.inspects-before-planning",
    "guided-adoption.preview-precedes-confirmation",
    "guided-adoption.unconfirmed-apply-refused",
    "guided-adoption.confirmation-is-digest-bound",
    "guided-adoption.generated-team-is-valid",
    "guided-adoption.human-and-ai-starts-exist",
    "adoption.proposal-verified",
    "candidate.remains-proposal-only",
    "external-integrations.remain-disabled",
    "team.compiles-all-platforms",
    "team.stops-before-human-approval",
    "team.reference-loop-reaches-reviewed-draft-pr",
    "team.replay-has-no-new-side-effects",
    "native.contracts-discoverable",
    "native.reference-loop-reaches-draft-pr",
    "native.replay-has-no-new-side-effects",
    "native.external-gates-remain-closed"
  ],
  "human_replay_required": true
}
